{
  "schema_version": "1.0.0",
  "template_id": "t2_competitor",
  "generated_at": "2026-10-21T00:00:00Z",
  "identity": {
    "task_id": "11111111-1111-1111-1111-111111111113",
    "brand": "Fixture Brand",
    "category": "吸乳器",
    "competitors": [
      "Fixture Competitor A",
      "Fixture Competitor B"
    ],
    "markets": [
      "US",
      "DE"
    ],
    "window": {
      "start": "2026-01-01",
      "end": "2026-09-23",
      "days": 265
    },
    "product": "结构夹具吸乳器",
    "model": "FIX-T2",
    "variant_id": "v-fixture-2",
    "sku": "SKU-FIXTURE-2",
    "asin": "B0FIXTURE2",
    "parent_asin": null,
    "bundle": "单支装",
    "offer": "1 件",
    "mapping_confidence": 0.9,
    "family_children": []
  },
  "decision": {
    "decision_question": "我们的可穿定位，在哪个市场尚未被占据？",
    "answer": "结构夹具只演示竞品合同结构，不作定位结论。",
    "protect": [
      "夹具结构与价格口径"
    ],
    "resolve": [
      "货架表述与价格带的呈现方式"
    ],
    "prove": [
      "真实 T2 需要 2 品牌 × 2 市场"
    ]
  },
  "gates": [
    {
      "gate_id": "G-Plan",
      "status": "pass",
      "note": "夹具计划已登记。"
    },
    {
      "gate_id": "G-Cost",
      "status": "pending",
      "note": "夹具不产生真实成本。"
    },
    {
      "gate_id": "G-Evidence",
      "status": "pending",
      "note": "夹具等级最高 L2。"
    },
    {
      "gate_id": "G-Claim",
      "status": "pending",
      "note": "夹具不产生真实 claim。"
    },
    {
      "gate_id": "G-Publish",
      "status": "blocked",
      "note": "结构夹具不得发布。"
    }
  ],
  "coverage": {
    "cells": [
      {
        "source_tool_id": "apify_amazon_product_scraper",
        "market": "US",
        "window": {
          "start": "2026-01-01",
          "end": "2026-09-23",
          "days": 265
        },
        "record_count": 4,
        "frame_member_count": 4,
        "status": "success"
      },
      {
        "source_tool_id": "apify_amazon_price_tracker",
        "market": "DE",
        "window": {
          "start": "2026-01-01",
          "end": "2026-09-23",
          "days": 265
        },
        "record_count": 3,
        "frame_member_count": 3,
        "status": "success"
      }
    ]
  },
  "metrics": [
    {
      "metric_id": "listing_count",
      "label": "美国货架夹具商品数",
      "numerator": 4,
      "denominator": 4,
      "count_type": "canonical_record",
      "frame": "T2 US 货架夹具帧",
      "as_of": "2026-09-23",
      "note": "夹具数字，不代表真实货架。"
    },
    {
      "metric_id": "price_observation_count",
      "label": "德国价格夹具记录数",
      "numerator": 3,
      "denominator": 3,
      "count_type": "canonical_record",
      "frame": "T2 DE 价格夹具帧",
      "as_of": "2026-09-23",
      "note": "页面价，不是成交均价。"
    }
  ],
  "claims": [
    {
      "claim_id": "c-t2-us-shelf",
      "text": "夹具样本显示，US 货架的可穿表述集中在两个竞品上。",
      "claim_status": "hypothesis",
      "evidence_grade": "L2_fixture_local",
      "scope": {
        "market": "US",
        "window": {
          "start": "2026-01-01",
          "end": "2026-09-23",
          "days": 265
        },
        "sample_n": 4
      },
      "counterevidence_text": "未发现反证。夹具不构成真实反证。",
      "owner": "22222222-2222-2222-2222-222222222224",
      "evidence_ids": [
        "e-t2-us-support",
        "e-t2-us-gap"
      ]
    },
    {
      "claim_id": "c-t2-de-price",
      "text": "夹具样本显示，DE 页面价带缺少中段价格记录。",
      "claim_status": "hypothesis",
      "evidence_grade": "L2_fixture_local",
      "scope": {
        "market": "DE",
        "window": {
          "start": "2026-01-01",
          "end": "2026-09-23",
          "days": 265
        },
        "sample_n": 3
      },
      "counterevidence_text": "未发现反证。夹具不构成真实反证。",
      "owner": "22222222-2222-2222-2222-222222222224",
      "evidence_ids": [
        "e-t2-de-support",
        "e-t2-de-gap"
      ]
    }
  ],
  "evidences": [
    {
      "evidence_id": "e-t2-us-support",
      "claim_id": "c-t2-us-shelf",
      "role": "support",
      "raw_record_id": "44444444-4444-4444-4444-444444444601",
      "source_tool_id": "apify_amazon_product_scraper",
      "url": "https://example.com/fixture/t2/us/listing-1",
      "excerpt": "夹具摘录：货架标题含可穿表述。",
      "captured_at": "2026-09-23T00:00:00Z",
      "market": "US",
      "locale": "en-US",
      "evidence_grade": "L2_fixture_local"
    },
    {
      "evidence_id": "e-t2-us-gap",
      "claim_id": "c-t2-us-shelf",
      "role": "gap",
      "raw_record_id": null,
      "source_tool_id": "apify_amazon_price_tracker",
      "url": null,
      "excerpt": "夹具缺口：美国价格历史未覆盖。",
      "captured_at": "2026-09-23T00:00:00Z",
      "market": "US",
      "locale": "en-US",
      "evidence_grade": "L2_fixture_local"
    },
    {
      "evidence_id": "e-t2-de-support",
      "claim_id": "c-t2-de-price",
      "role": "support",
      "raw_record_id": "44444444-4444-4444-4444-444444444602",
      "source_tool_id": "apify_amazon_price_tracker",
      "url": "https://example.com/fixture/t2/de/price-1",
      "excerpt": "夹具摘录：页面价落在价格带两端。",
      "captured_at": "2026-09-23T00:00:00Z",
      "market": "DE",
      "locale": "de-DE",
      "evidence_grade": "L2_fixture_local"
    },
    {
      "evidence_id": "e-t2-de-gap",
      "claim_id": "c-t2-de-price",
      "role": "gap",
      "raw_record_id": null,
      "source_tool_id": "apify_amazon_product_scraper",
      "url": null,
      "excerpt": "夹具缺口：德国中段价格商品未采集。",
      "captured_at": "2026-09-23T00:00:00Z",
      "market": "DE",
      "locale": "de-DE",
      "evidence_grade": "L2_fixture_local"
    }
  ],
  "run_ledger": [
    {
      "run_id": "33333333-3333-3333-3333-333333333321",
      "tool_id": "apify_amazon_product_scraper",
      "endpoint_type": "apify_amazon_product_scraper",
      "actor_id": "junglee/amazon-crawler",
      "unit": "request",
      "quantity": 1,
      "unit_price": "0.000000",
      "total_cost_usd": "0.000000",
      "authorization_id": null,
      "evidence_grade": "L2_fixture_local",
      "started_at": "2026-09-23T00:00:00Z",
      "finished_at": "2026-09-23T00:00:01Z",
      "outcome": "success"
    },
    {
      "run_id": "33333333-3333-3333-3333-333333333322",
      "tool_id": "apify_amazon_price_tracker",
      "endpoint_type": "apify_amazon_price_tracker",
      "actor_id": null,
      "unit": "request",
      "quantity": 1,
      "unit_price": "0.000000",
      "total_cost_usd": "0.000000",
      "authorization_id": null,
      "evidence_grade": "L2_fixture_local",
      "started_at": "2026-09-23T00:00:02Z",
      "finished_at": "2026-09-23T00:00:03Z",
      "outcome": "success"
    }
  ],
  "limits": [
    "本文件是结构夹具（fixture），不是真实黄金报告。",
    "夹具数据不来自真实采集，不得用于业务决策。",
    "价格是页面价，不是成交均价。",
    "热力图是定性优先级，不是量化评分。",
    "定位坐标必须由人给定。夹具不生成定位。",
    "不推断销量与份额。"
  ],
  "unknowns": [
    "真实黄金报告需要 T2 跑 2 品牌 × 2 市场。",
    "夹具不含真实价格历史与 A+ 内容。"
  ],
  "artifact": {
    "report_html_sha256": "",
    "sop_html_sha256": "",
    "contract_sha256": "4fe1e375cb00ee693dee18ea65b3a80ccd61e5f43efe0230afce8a2fda11aed5"
  }
}
