{
  "schema_version": "1.0.0",
  "template_id": "t5_compliance",
  "generated_at": "2026-10-21T00:00:00Z",
  "identity": {
    "task_id": "11111111-1111-1111-1111-111111111112",
    "brand": "Fixture Brand",
    "category": "婴儿监测器",
    "competitors": [],
    "markets": [
      "US",
      "UK"
    ],
    "window": {
      "start": "2025-10-01",
      "end": "2026-10-01",
      "days": 365
    },
    "product": "结构夹具监护器",
    "model": "FIX-T5",
    "variant_id": null,
    "sku": "SKU-FIXTURE-5",
    "asin": null,
    "parent_asin": null,
    "bundle": null,
    "offer": null,
    "mapping_confidence": 0.9,
    "family_children": []
  },
  "decision": {
    "decision_question": "我们有哪些 SKU 处在已公开的召回或安全通报中？",
    "answer": "结构夹具只演示通报证据结构，不作法律结论。",
    "protect": [
      "夹具结构与原文链接"
    ],
    "resolve": [
      "命中与未匹配的呈现方式"
    ],
    "prove": [
      "真实 T5 需要 20 条已知通报的 golden set"
    ]
  },
  "gates": [
    {
      "gate_id": "G-Plan",
      "status": "pass",
      "note": "夹具计划已登记。"
    },
    {
      "gate_id": "G-Cost",
      "status": "pending",
      "note": "夹具不产生真实成本。"
    },
    {
      "gate_id": "G-Evidence",
      "status": "pending",
      "note": "夹具等级最高 L2。"
    },
    {
      "gate_id": "G-Claim",
      "status": "pending",
      "note": "夹具不产生真实 claim。"
    },
    {
      "gate_id": "G-Publish",
      "status": "blocked",
      "note": "结构夹具不得发布。"
    }
  ],
  "coverage": {
    "cells": [
      {
        "source_tool_id": "public_feed",
        "market": "US",
        "window": {
          "start": "2025-10-01",
          "end": "2026-10-01",
          "days": 365
        },
        "record_count": 2,
        "frame_member_count": 2,
        "status": "success"
      },
      {
        "source_tool_id": "generic_web",
        "market": "UK",
        "window": {
          "start": "2025-10-01",
          "end": "2026-10-01",
          "days": 365
        },
        "record_count": 1,
        "frame_member_count": 1,
        "status": "success"
      },
      {
        "source_tool_id": "public_feed",
        "market": "UK",
        "window": {
          "start": "2025-10-01",
          "end": "2026-10-01",
          "days": 365
        },
        "record_count": 0,
        "frame_member_count": 0,
        "status": "empty"
      }
    ]
  },
  "metrics": [
    {
      "metric_id": "recall_hit_count",
      "label": "美国公开通报命中数",
      "numerator": 1,
      "denominator": 2,
      "count_type": "occurrence",
      "frame": "T5 US 公开通报夹具帧",
      "as_of": "2026-10-01",
      "note": "夹具数字，不代表真实命中。"
    },
    {
      "metric_id": "unmatched_count",
      "label": "英国未匹配记录数",
      "numerator": 1,
      "denominator": 1,
      "count_type": "canonical_record",
      "frame": "T5 UK 夹具帧",
      "as_of": "2026-10-01",
      "note": "未匹配记为 gap，不表示无风险。"
    }
  ],
  "claims": [
    {
      "claim_id": "c-t5-us-hit",
      "text": "夹具样本命中 1 条美国公开召回记录。型号字段待人工核对。",
      "claim_status": "hypothesis",
      "evidence_grade": "L2_fixture_local",
      "scope": {
        "market": "US",
        "window": {
          "start": "2025-10-01",
          "end": "2026-10-01",
          "days": 365
        },
        "sample_n": 2
      },
      "counterevidence_text": "未发现反证。夹具命中不等于真实风险。",
      "owner": "22222222-2222-2222-2222-222222222223",
      "evidence_ids": [
        "e-t5-us-support",
        "e-t5-us-gap"
      ]
    },
    {
      "claim_id": "c-t5-uk-gap",
      "text": "夹具样本在英国未匹配到公开通报，记为证据缺口。",
      "claim_status": "evidence_gap",
      "evidence_grade": "L2_fixture_local",
      "scope": {
        "market": "UK",
        "window": {
          "start": "2025-10-01",
          "end": "2026-10-01",
          "days": 365
        },
        "sample_n": 1
      },
      "counterevidence_text": "未匹配不表示没有风险。",
      "owner": "22222222-2222-2222-2222-222222222223",
      "evidence_ids": [
        "e-t5-uk-gap"
      ]
    }
  ],
  "evidences": [
    {
      "evidence_id": "e-t5-us-support",
      "claim_id": "c-t5-us-hit",
      "role": "support",
      "raw_record_id": "44444444-4444-4444-4444-444444444501",
      "source_tool_id": "public_feed",
      "url": "https://example.com/fixture/t5/us/recall-1",
      "excerpt": "夹具通报摘录：产品名与型号占位。",
      "captured_at": "2026-10-01T00:00:00Z",
      "market": "US",
      "locale": "en-US",
      "evidence_grade": "L2_fixture_local"
    },
    {
      "evidence_id": "e-t5-us-gap",
      "claim_id": "c-t5-us-hit",
      "role": "gap",
      "raw_record_id": null,
      "source_tool_id": "public_feed",
      "url": null,
      "excerpt": "夹具缺口：型号字段未人工核对。",
      "captured_at": "2026-10-01T00:00:00Z",
      "market": "US",
      "locale": "en-US",
      "evidence_grade": "L2_fixture_local"
    },
    {
      "evidence_id": "e-t5-uk-gap",
      "claim_id": "c-t5-uk-gap",
      "role": "gap",
      "raw_record_id": null,
      "source_tool_id": "generic_web",
      "url": null,
      "excerpt": "夹具未匹配：公开通报中没有对应记录。",
      "captured_at": "2026-10-02T00:00:00Z",
      "market": "UK",
      "locale": "en-GB",
      "evidence_grade": "L2_fixture_local"
    }
  ],
  "run_ledger": [
    {
      "run_id": "33333333-3333-3333-3333-333333333311",
      "tool_id": "public_feed",
      "endpoint_type": "public_feed",
      "actor_id": null,
      "unit": "request",
      "quantity": 1,
      "unit_price": "0.000000",
      "total_cost_usd": "0.000000",
      "authorization_id": null,
      "evidence_grade": "L2_fixture_local",
      "started_at": "2026-10-01T00:00:00Z",
      "finished_at": "2026-10-01T00:00:01Z",
      "outcome": "success"
    },
    {
      "run_id": "33333333-3333-3333-3333-333333333312",
      "tool_id": "public_feed",
      "endpoint_type": "public_feed",
      "actor_id": null,
      "unit": "request",
      "quantity": 1,
      "unit_price": "0.000000",
      "total_cost_usd": "0.000000",
      "authorization_id": null,
      "evidence_grade": "L2_fixture_local",
      "started_at": "2026-10-01T00:00:02Z",
      "finished_at": "2026-10-01T00:00:03Z",
      "outcome": "empty"
    },
    {
      "run_id": "33333333-3333-3333-3333-333333333313",
      "tool_id": "generic_web",
      "endpoint_type": "generic_web",
      "actor_id": null,
      "unit": "request",
      "quantity": 1,
      "unit_price": "0.000000",
      "total_cost_usd": "0.000000",
      "authorization_id": null,
      "evidence_grade": "L2_fixture_local",
      "started_at": "2026-10-01T00:00:04Z",
      "finished_at": "2026-10-01T00:00:05Z",
      "outcome": "success"
    }
  ],
  "limits": [
    "本文件是结构夹具（fixture），不是真实黄金报告。",
    "夹具数据不来自真实采集，不得用于业务决策。",
    "不做法律意见。不写合规或合法结论。",
    "未匹配记为 gap。不得写无风险。"
  ],
  "unknowns": [
    "真实黄金报告需要 T5 跑 2 品牌 × 2 市场。",
    "真实 T5 需要 20 条已知通报的 golden set。"
  ],
  "artifact": {
    "report_html_sha256": "",
    "sop_html_sha256": "",
    "contract_sha256": "a8880db453bac9052820b63d63751e34c85aca0dfd0f55cef5ed90e761857118"
  }
}
